№,"Авторы (Фамилия, инициалы) пример: Kononenko V.V., Образцова Е.Д.",Название доклада (без кавычек),Название конференции (без кавычек) пример: Х Всероссийский семинар по радиофизике миллиметровых и субмиллиметровых волн,"Место проведения пример: Нижний Новгород, Россия",даты проведения пример: 29 февраля – 3 марта 2016 года,"Номер страницы в сборнике тезисов (обязательно!) пример, если номера страницы нет: не указана","Тип доклада (устный, постерный, приглашенный)","DOI (если есть, в формате https://doi.org/10.1038/srep22101)",ISBN (если есть),"Отдел (ОСПЯ, ОЛФ, ОТИАМ)","Зав. Лабораторией (только ИОФ РАН, другие институты указывать не надо)",Номер темы ФАНО (Парус 8)
6,"Savelieva T.A., Linkov K.G., Borodkin A.V., Volkov V.V., Goryajnov S.A., Potapov A.A., Loschenov V.B.",Method of intraoperative spectroscopic detection of tumor tissues in neurosurgery.,18th International Conference on Laser Optics ICLO 2018,"St.Petersburg, Russia",04-08 June 2018,"TuSMB-p18, 86",постерный,10.1109/LO.2018.8435194,978-1-5386-3612-1,ОСПЯ,Лощенов В.Б.,0024-2018-0035
13,"Loshchenov M.V., Savelieva T.A., Golbin D.A., Linkov K.G., Loschenov V.B.",Laser fiber optic equipment for embedding video photodynamic diagnostic and therapy control features into standard surgical instruments.,18th International Conference on Laser Optics ICLO 2018,"St.Petersburg, Russia",04-08 June 2018,"ThSMD-24, 101",устный,10.1109/LO.2018.8435425,978-1-5386-3612-1,ОСПЯ,Лощенов В.Б.,0024-2018-0035
4,"Pominova D.V., Ryabova A.V., Grachev P.V., Romanishkin I.D., Proydakova V.Yu., Kuznetsov S.V., Voronov V.V., Fedorov P.P., Loschenov V.B.",Optimization of upconversion nanoparticles excitation regimes for selective heating and effective thermometry in biological tissues.,18th International Conference on Laser Optics ICLO 2018,"St.Petersburg, Russia",04-08 June 2018,"ThSMC-32, 97",устный,10.1109/LO.2018.8435509,978-1-5386-3612-1,ОСПЯ,Лощенов В.Б.,0024-2018-0035
7,"Sharova A.S., Maklygina Yu.S., Ryabova A.V., Loschenov V.B.",Spectral properties comparative analysis of normal and tumor brain tissues in the visible and near infrared optical ranges.,18th International Conference on Laser Optics ICLO 2018,"St.Petersburg, Russia",04-08 June 2018,"WeSMB-21, 89",устный,10.1109/LO.2018.8435632,978-1-5386-3612-1,ОСПЯ,Лощенов В.Б.,0024-2018-0035
11,"Farrakhova D.S., Yakavets I.V., Loschenov V.B., Bolotine L.N., Zorin V.P.",Comparitive accumulation study of chlorin group photosensitizers on monolayer and multicellular tumor spheroids of cell culture.,18th International Conference on Laser Optics ICLO 2018,"St.Petersburg, Russia",04-08 June 2018,"ThSMD-17, 100",устный,10.1109/LO.2018.8435633,978-1-5386-3612-1,ОСПЯ,Лощенов В.Б.,0024-2018-0035
10,"Steiner R.W., Scalfi-Happ C., Zhu Z., Wiehe A., Ryabova A., Loschenov V., Wittig R.",Cellular reactions of organic nanoparticles during PDT (Invited paper).,18th International Conference on Laser Optics ICLO 2018,"St.Petersburg, Russia",04-08 June 2018,"ThSMD-06, 99",приглашенный,10.1109/LO.2018.8435652,978-1-5386-3612-1,ОСПЯ,Лощенов В.Б.,0024-2018-0035
12,"Akhlyustina E.V., Meerovich G.A., Tiganova I.G., Makarova E.A., Alekseeva N.V., Philipova N.I., Lukyanets E.A., Romanova Yu.M., Loschenov V.B.",Study of new infrared photosensitizers for photodynamic inactivation of pathogenic bacteria based on synthetic bacteriochlorin derivatives.,18th International Conference on Laser Optics ICLO 2018,"St.Petersburg, Russia",04-08 June 2018,"ThSMD-22, 100",устный,10.1109/LO.2018.8435686,978-1-5386-3612-1,ОСПЯ,Лощенов В.Б.,0024-2018-0035
8,"Maklygina Yu.S., Yusubalieva G.M., Romanishkin I.D., Ryabova A.V., Chekhonin V.P., Loschenov V.B.",TAM identification by fluorescence lifetime on different models.,18th International Conference on Laser Optics ICLO 2018,"St.Petersburg, Russia",04-08 June 2018,"WeSMC-12, 92",устный,10.1109/LO.2018.8435696,978-1-5386-3612-1,ОСПЯ,Лощенов В.Б.,0024-2018-0035
9,"Ryabova A.V., Lukyanets E.A., Klimov A.I., Pominova D.V., Makarov V.I., Romanishkin I.D., Herrmann I., Steiner R., Loschenov V.B.",Iron oxide nanoparticles conjugated with Zn phthalocyanine for photoinduced anticancer immune response.,18th International Conference on Laser Optics ICLO 2018,"St.Petersburg, Russia",04-08 June 2018,"WeSMD-p14, 95",постерный,10.1109/LO.2018.8435777,978-1-5386-3612-1,ОСПЯ,Лощенов В.Б.,0024-2018-0035
15,"Orlovskii Yu.V., Popov A.V., Orlovskaya E.O., Vanetsev A.S., Sildos I., Grachev P.V., Ryabova A.V.",A crystal host selection for aqueous colloidal luminescent nanocrystals doped by Nd3+ used for bioimaging in first biological window.,18th International Conference on Laser Optics ICLO 2018,"St.Petersburg, Russia",04-08 June 2018,"ThSMC-33, 97",устный,10.1109/LO.2018.8435789,978-1-5386-3612-1,ОСПЯ,Лощенов В.Б.,0024-2018-0035
1,"Ryabova A., Pominova D., Romanishkin I., Grachev P., Makarov V., Vanetsev A., Orlovskaya E., Sildos I., Loschenov V., Orlovskii Yu.",Multiphoton excitation of upconversion luminescence of Nd3+-doped nanoparticles in laser scanning microscopy.,"2nd Conference and Spring School on Properties, Design and Applications of Upconversion Nanomaterials UPCON 2018","Valencia, Spain",01-07 April 2018,"P54, 130",постерный,,,ОСПЯ,Лощенов В.Б.,0024-2018-0035
2,"Pominova D., Ryabova A., Romanishkin I., Grachev P., Kuznetsov S., Voronov V., Proydakova V.",Theoretical modeling of optimal Tm3+ doping concentrations for effective heating and thermometry.,"2nd Conference and Spring School on Properties, Design and Applications of Upconversion Nanomaterials UPCON 2018","Valencia, Spain",01-07 April 2018,"P49, 124",постерный,,,ОСПЯ,Лощенов В.Б.,0024-2018-0035
3,"Proydakova V.Yu., Kuznetsov S.V., Pominova D.V., Voronov V.V., Uvarov O.V., Yapryntsev A.D., Ivanov V.K.",Synthesis and energy yield of β-NaGdF4:Yb:Er nanoparticles for theranostics.,"2nd Conference and Spring School on Properties, Design and Applications of Upconversion Nanomaterials UPCON 2018","Valencia, Spain",01-07 April 2018,"P69, 149",постерный,,,ОСПЯ,Лощенов В.Б.,0024-2018-0035
5,"Potapov A.A., Goryajnov S.A., Chelushkin D.M., Chernishov K.A., Savelieva T.A., Loschenov V.B., Okhlopkov V.A., Konovalov A.N., Zelenkov P.V., Eliava Sh.Sh., Shehtman O.D., Usachev D.Yu., Lukshin V.A.",Biophotonics in neurosurgery.,18th International Conference on Laser Optics ICLO 2018,"St.Petersburg, Russia",04-08 June 2018,"TuSMP-05, 80","пленарный, приглашенный",,978-1-5386-3612-1,ОСПЯ,Лощенов В.Б.,0024-2018-0035
14,"Zolotareva J.O., Loschenov V.B.",Method of laser-induced fluorescent diagnostics of enamel microcracks using aluminum phthalocyanine nanoparticles.,18th International Conference on Laser Optics ICLO 2018,"St.Petersburg, Russia",04-08 June 2018,"ThSMD-27, 101",устный,,978-1-5386-3612-1,ОСПЯ,Лощенов В.Б.,0024-2018-0035
16,"D.V. Pominova, A.V. Ryabova, C. Scalfi-Happ, Z. Zhu, R. Wittig, A. Wiehe, S. Graefe, R.W. Steiner, V.B. Loschenov",Fiber-optic technique for quantitative determination of the chlorin derivatives nanoparticles accumulation in the mice organs,Photodynamic Therapy & Photodiagnosis Update 2018,"Kochel a. See, Germany",18-22 September 2018,307,постерный,,,,,
17,"Yu. S. Maklygina, I. D. Romanishkin, A. V. Ryabova, R. Steiner, V. B. Loschenov",A novel spheroid model for studying intercellular photosensitizer-mediated tumour and immune cell communication,Photodynamic Therapy & Photodiagnosis Update 2018,"Kochel a. See, Germany",18-22 September 2018,803,постерный,,,,,
18,"A.V. Ryabova, D.V. Pominova, C. Scalfi-Happ, Z. Zhu, R. Wittig, A. Wiehe, S. Graefe, R. W. Steiner, V.B. Loschenov",Tissues distribution of organic crystalline mTHPC nanoparticles on model inoculated tumors in vivo,Photodynamic Therapy & Photodiagnosis Update 2018,"Kochel a. See, Germany",18-22 September 2018,804,постерный,,,,,
19,"V.Levkin, S. Kharnas, M.Loschenov, N.Kalyagina, V.Loschenov",Fluorescence Image Analyzer for Intraoperative Use in Gastrointerology,Photodynamic Therapy & Photodiagnosis Update 2018,"Kochel a. See, Germany",18-22 September 2018,904,постерный,,,,,
20,"A.A. Shiryaev, G.K. Musaev, I.V. Reshetov, V.V. Levkin, M.V. Loschenov, A.V. Borodkin, V.V. Vlokov, V.I. Makarov,, V.B. Loschenov",Combined treatment of non-resectable cholangiocellular cancer complicated with mechanical jaundice,Photodynamic Therapy & Photodiagnosis Update 2018,"Kochel a. See, Germany",18-22 September 2018,906,постерный,,,,,
21,"R. Wittig, Z. Zhu, C. Scalfi-Happ, A. Ryabova, S. Gräfe, A. Wiehe, V. Loschenov, R. Steiner",Photodynamic activity of Temoporfin nanoparticles induces a shift to the proinflammatory M1-phenotype in polarized macrophages,Photodynamic Therapy & Photodiagnosis Update 2018,"Kochel a. See, Germany",18-22 September 2018,802,постерный,,,,,
22,"N. Kalyagina, M. Loshchenov, V.Loschenov",Clinical Spectral Fluorescence and Back-Scattering Study of Bladder Neoplasmes,Photodynamic Therapy & Photodiagnosis Update 2018,"Kochel a. See, Germany",18-22 September 2018,1002,постерный,,,,,
23,"Д.В. Поминова, А.В. Рябова, И.Д. Романишкин, П.В. Грачев, В.Ю. Пройдакова, С.В. Кузнецов, В. В. Воронов  ","Люминесцентная термометрия in vitro c использованием ап-конверсионных наночастиц NaGdF4:Yb3+-Er3+, Yb3+-Tm3+","17-я международная научная конференция-школа «Материалы нано-, микро-, оптоэлектроники и волоконной оптики: физические свойства и применение» 18-21 сентября 2018 г.","Саранск, Росиия",18-21 сентября 2018,"185, 202",устный,,978-5-7103-3637-3,ОСПЯ,Лощенов В.Б.,
24," D.V. Pominova, V.Yu. Proydakova, I.D. Romanishkin, A.V. Ryabova, P.V. Grachev, S.V. Kuznetsov, V.V. Voronov, P.P. Fedorov",Strategies to enhance the sensitivity of NaGdF4:Yb-Tm based nanothermometers,SFM'18 – International Symposium Optics and Biophotonics September ,"Saratov, Russia",24- 29 September 2018,не указана http://sfm.eventry.org/report/3384,интернет доклад,,,ОСПЯ,Лощенов В.Б.,
25,"Д.В. Поминова, В.Ю. Пройдакова, И.Д. Романишкин, Ю.А. Ермакова, Д.С. Ясыркина, А.С. Ванецев, С.В. Кузнецов, А.В. Рябова",Легированные редкоземельными ионами кристаллические наночастицы для биофотоники,Школа-конференция молодых ученых ИОФ РАН «Прохоровские недели» ,"Москва, Россия",11-23 октября 2018г.,122-124,устный,,978-5-905109-02-7,ОСПЯ,Лощенов В.Б.,
26,"Proydakova V.Yu., Pominova D.V., Kuznetsov S.V., Voronov V.V., Yapryntsev A.D., Ivanov V.K., Fedorov P.P.",Investigation of synthesis and luminescence properties of NaGdF4:Yb:Er hexagonal phase,X Международная научная конференция «Кинетика и механизмы кристаллизации. Кристаллизация и материалы нового поколения»,"Суздаль, Россия",1-6 июля 2018г.,322-323,устный,,,ОСПЯ,Лощенов В.Б.,
27,"Поминова Д.В., Грачев П.В., Романишкин И.Д., Бикмухаметова И.Р., Макаров В.И., Рябова А.В. ",Теоретическое и экспериментальное моделирование лазерно-индуцированного нагрева различных биологических тканей с использованием ап-конверсионных и металлических наночастиц, VII Всероссийский Конгресс с международным участием «ФОТОДИНАМИЧЕСКАЯ ТЕРАПИЯ И ФОТОДИАГНОСТИКА»,"Москва, Россия",27-28 сентября 2018 г.,не указана ,устный,,ISSN 2413-9432,ОСПЯ,Лощенов В.Б.,
28,В.Б. Лощенов,Новые неинвазивные инструментальные подходы к прогностической оценке состояния опухолевой ткани, VII Всероссийский Конгресс с международным участием «ФОТОДИНАМИЧЕСКАЯ ТЕРАПИЯ И ФОТОДИАГНОСТИКА»,"Москва, Россия",27-28 сентября 2018 г.,,устный,,ISSN 2413-9432,,,
29,"Фаррахова Д.С., Макаров В.И., Грачев П.В., Лощенов В.Б.",Сравнительный анализ фотосенсибилизаторов и флуоресцентных красителей для флуоресцентной визуализации неоангиогенеза кровеносной и лимфотической системы при трансплантации кожи, VII Всероссийский Конгресс с международным участием «ФОТОДИНАМИЧЕСКАЯ ТЕРАПИЯ И ФОТОДИАГНОСТИКА»,"Москва, Россия",27-28 сентября 2018 г.,27,устный,,ISSN 2413-9432,,,
30,"Савельева Т.А., Волков В.В., Линьков К.Г., Бородкин А.В., Потапов А.А., Горяйнов С.А., Огурцова А.А., Томас Крёбер, Александер Допельштайн, Лощенов В.Б.",Аппаратно-программный комплекс для интраоперационной спектроскопической детекции границ внутричерепных опухолей, VII Всероссийский Конгресс с международным участием «ФОТОДИНАМИЧЕСКАЯ ТЕРАПИЯ И ФОТОДИАГНОСТИКА»,"Москва, Россия",27-28 сентября 2018 г.,,устный,,ISSN 2413-9432,,,
31,"Макаров В.И., Грачев П.В., Лощенов В.Б.",Неинвазивный видеофлуоресцентный анализ распределения фотосенсибилизаторов по лимфотоку при подкожном введении, VII Всероссийский Конгресс с международным участием «ФОТОДИНАМИЧЕСКАЯ ТЕРАПИЯ И ФОТОДИАГНОСТИКА»,"Москва, Россия",27-28 сентября 2018 г.,,устный,,ISSN 2413-9432,,,
32,"Маклыгина ЮС, Романишкин ИД, Лощенов ВБ",Фенотипирование фотосенсибилизированных клеток стромы опухоли методом флуоресцентной время-разрешенной микроскопии, VII Всероссийский Конгресс с международным участием «ФОТОДИНАМИЧЕСКАЯ ТЕРАПИЯ И ФОТОДИАГНОСТИКА»,"Москва, Россия",27-28 сентября 2018 г.,,устный,,ISSN 2413-9432,,,
33,"Поминова Д.В., Грачев П.В., Романишкин И.Д., Бикмухаметова И., Макаров В.И., Рябова А.В.",Теоретическое и экспериментальное моделирование лазерно-индуцированного нагрева различных биологических тканей с использованием ап-конверсионных и металлических наночастиц, VII Всероссийский Конгресс с международным участием «ФОТОДИНАМИЧЕСКАЯ ТЕРАПИЯ И ФОТОДИАГНОСТИКА»,"Москва, Россия",27-28 сентября 2018 г.,,устный,,ISSN 2413-9432,,,
34,"Ахлюстина Е.В., Меерович Г.А., Тиганова И.Г., Филипова Н.И., Макарова Е.А., Лукьянец Е.А., Романова Ю.М., Лощенов В.Б.",Взаимодействие катионных фотосенсибилизаторов с биопленками патогенных бактерий, VII Всероссийский Конгресс с международным участием «ФОТОДИНАМИЧЕСКАЯ ТЕРАПИЯ И ФОТОДИАГНОСТИКА»,"Москва, Россия",27-28 сентября 2018 г.,28,устный,,ISSN 2413-9432,,,
35,"Ахлюстина Е.В., Меерович Г.А., Савельева Т.А., Линьков К.Г., Лощенов В.Б.",Расширение динамического диапазона спектроанализатора для фармакокинетических исследований, VII Всероссийский Конгресс с международным участием «ФОТОДИНАМИЧЕСКАЯ ТЕРАПИЯ И ФОТОДИАГНОСТИКА»,"Москва, Россия",27-28 сентября 2018 г.,4,постерный,,ISSN 2413-9432,,,
36,"Макаров В.И., Коршунова А.В., Зорина О.А., Кречина Е.К., Пономарев Г.В., Рябова А.В.",Оценка эффективности фотосенсибилизатора хлорина е6 для фотодинамического отбеливания зубов, VII Всероссийский Конгресс с международным участием «ФОТОДИНАМИЧЕСКАЯ ТЕРАПИЯ И ФОТОДИАГНОСТИКА»,"Москва, Россия",27-28 сентября 2018 г.,14,постерный,,ISSN 2413-9432,,,
37,"Бикмухаметова И.Р., Романишкин И.Д., Маклыгина Ю.С.","Исследование дезоксигенации гемоглобина и фотобличинга фотосенсибилизатора ""Холосенс"" in vitro", VII Всероссийский Конгресс с международным участием «ФОТОДИНАМИЧЕСКАЯ ТЕРАПИЯ И ФОТОДИАГНОСТИКА»,"Москва, Россия",27-28 сентября 2018 г.,18,постерный,,ISSN 2413-9432,,,
38,"Грачев П.В., Макаров В.И., Джемилова З.Н., Линьков К.Г., Галстян Г.Р., Лощенов В.Б.",Прецизионные средства доставки лазерного излучения при ФД и ФДТ, VII Всероссийский Конгресс с международным участием «ФОТОДИНАМИЧЕСКАЯ ТЕРАПИЯ И ФОТОДИАГНОСТИКА»,"Москва, Россия",27-28 сентября 2018 г.,22,постерный,,ISSN 2413-9432,,,
39,"Маклыгина Ю.С., Романишкин И.Д., Юсубалиева Г.М., Скобельцин А.С., Рябова А.В., Чехонин В.П., Лощенов В.Б.",Спектрально-флуоресцентный метод идентификации опухоль-ассоциированных макрофагов, VII Всероссийский Конгресс с международным участием «ФОТОДИНАМИЧЕСКАЯ ТЕРАПИЯ И ФОТОДИАГНОСТИКА»,"Москва, Россия",27-28 сентября 2018 г.,26,постерный,,ISSN 2413-9432,,,
40,"Коршунова А.В., Зорина О.А., Кречина Е.К., Пономарев Г.В., Макаров В.И.",Определение эффективности фотодинамического отбеливания зубов в клинической практике, VII Всероссийский Конгресс с международным участием «ФОТОДИНАМИЧЕСКАЯ ТЕРАПИЯ И ФОТОДИАГНОСТИКА»,"Москва, Россия",27-28 сентября 2018 г.,52,постерный,,ISSN 2413-9432,,,
